{
  "lesson_id": "JCA-M04-L01",
  "module_id": "JCA-M04",
  "title": "提示词在生成流程中的角色",
  "lesson_role": "CONCEPT",
  "scope": "Jimeng Product Layer；即梦 Seedance 2.5 产品页对提示词角色与描述要素的说明；不含写作方法。",
  "learner_outcomes": [
    "解释提示词属于流程中的输入步骤",
    "识别提示词需要描述的主体、动作、镜头与视觉风格"
  ],
  "knowledge_refs": ["JIM-K-0011", "JIM-K-0020"],
  "graph_support_refs": [],
  "opening": "这一课不教你怎么写，只回答「提示词在整个流程里干什么活」。把它想清楚了，后面两课的写法建议才有地方挂。",
  "teaching_points": [
    {
      "point_id": "M04-L01-P01",
      "knowledge_refs": ["JIM-K-0011"],
      "explanation": "产品页把「上传素材」与「输入提示词」列为**同一步骤**，也就是说提示词属于流程中的**输入环节**，不是生成之后的调整手段。它和素材一起决定这次生成要做什么。",
      "scope_note": "只说明提示词在流程中的位置；不给出结构、语法、字数或示例。"
    },
    {
      "point_id": "M04-L01-P02",
      "knowledge_refs": ["JIM-K-0020"],
      "explanation": "在产品页的生成流程中，提示词承担**描述**作用，用于描述四类要素：**主体、动作、镜头、视觉风格**。这是角色与要素说明，不是写作方法指导——它不告诉你怎么组织这些词、按什么顺序写、写多长。",
      "scope_note": "仅是角色与要素说明；不含提示词结构、语法、字数与示例，也不构成写作方法指导。"
    }
  ],
  "guided_practice": "`PEDAGOGICAL_EXAMPLE`（教学示例）：给定一句创作意图，在引导下指出它属于流程的哪一步，并把意图拆到主体、动作、镜头、视觉风格四个格子里（每格一句）。",
  "independent_practice": "不看四要素清单，自己写出提示词在流程中的位置与它承担的作用，并回答：产品页说明的这四类要素，能不能直接当作「提示词写作公式」使用？说明理由。",
  "completion_check": "学生能说明提示词属于流程的输入环节，并准确说出它描述的四类要素，同时指出这不是写作方法指导。",
  "boundaries_and_misconceptions": [
    "把提示词当成生成之后的调整手段，而不是输入环节的一部分。",
    "把四类描述要素当成写作公式或顺序要求。它只是角色与要素说明。",
    "为提示词补上结构、字数与语法规则。",
    "把提示词与素材当成两条互不相干的路径。它们同属一个步骤。"
  ],
  "lesson_summary": "本课确定了提示词在流程中的位置（输入环节，与素材同步）与作用（描述主体、动作、镜头、视觉风格），并明确它不是写作方法指导，为后两课的具体建议留出位置。",
  "limitations": "只覆盖该产品页对提示词角色与要素的说明；不含结构、语法、字数、示例与完整技法；本课不含界面操作。",
  "status": "full_course"
}
