{
  "lesson_id": "JCA-M07-L02",
  "module_id": "JCA-M07",
  "title": "AI 内容标识规则",
  "lesson_role": "SAFETY",
  "scope": "平台规则限 P14 所保存的第 4.2 节中关于 AI 内容标识的成对命题，以及它们对已生成内容处理方式的约束。",
  "learner_outcomes": [
    "解释平台对 AI 内容添加标识的依据",
    "解释不得遮挡、涂抹、修改或删除平台添加标识的要求"
  ],
  "knowledge_refs": ["JIM-K-0027", "JIM-K-0028"],
  "graph_support_refs": ["POL-E-0008"],
  "opening": "上一课处理的是\"输入什么\"，这一课处理\"输出之后怎么对待它\"。所选条款在第 4.2 节给出了一对规则：一条说明平台有权添加标识，另一条禁止用户破坏标识。这两条在同一节内前后相接，本课会把它们作为**同一课的内部结构**来讲，而不是拆成两课。",
  "teaching_points": [
    {
      "point_id": "M07-L02-P01",
      "knowledge_refs": ["JIM-K-0027"],
      "explanation": "所选条款规定：当用户生成、制作、发布或传播\"AI内容\"时，平台有权依据相关法律法规与强制性国家标准，采取适当方式添加标识。这条规则说明标识的**添加主体是平台**，添加依据是法规与标准，添加方式是\"适当方式\"。它本身没有规定标识长什么样、出现在哪里。",
      "scope_note": "不判断具体标识形式与技术实现；不表示平台一定对任何输出都添加标识。"
    },
    {
      "point_id": "M07-L02-P02",
      "knowledge_refs": ["JIM-K-0028"],
      "explanation": "紧接着，同一节禁止用户以任何方式遮挡、涂抹、修改或删除平台对 AI 内容添加的标识。这一条是禁止性义务，它的对象是\"平台上已经存在的标识\"。把两条连起来读，就能理解为什么这一课把\"添加依据\"放在前面：不看前一条，就无法解释后一条所禁止的行为到底针对什么。这个前后关系在本课内部成立，是**课内结构**，不构成两课之间的顺序。",
      "scope_note": "只表达对标识处理的禁止；不说明标识的显示位置或技术形态，也不表示所有输出都会被添加标识。"
    }
  ],
  "guided_practice": "给定三种对已生成内容的处理方式：①下载后把画面角落的标识区域裁掉再发布；②用修图工具把标识涂掉后重新上传；③原样发布不动标识。在引导下逐项判断是否触碰第 4.2 节的禁止性要求，并写出判断依据。以上三种处理方式为 `PEDAGOGICAL_EXAMPLE`，用于示范判断，不是产品功能说明。",
  "independent_practice": "自己列出三种\"看起来只是想美化画面、但可能触碰标识规则\"的处理方式，逐条说明依据。要求：不得编造产品承诺（例如\"平台一定会添加标识\"或\"标识一定在某个位置\"）。",
  "completion_check": "学生能解释标识的添加依据与不得破坏标识的要求，并正确判断给定的三种处理方式。",
  "boundaries_and_misconceptions": [
    "把\"平台有权添加标识\"读成\"平台一定对任何输出都添加标识\"。前者是权利，后者是承诺，本课不支持后者。",
    "自行描述标识的样式、位置或技术形态。条款只写\"适当方式\"，具体形式不在本课证据范围。",
    "把本课的两条规则理解成两课之间的顺序。它们的先后是同一节内的成对表述，属课内结构。",
    "把\"没看到标识\"当成\"可以随意处理画面\"。本课只能说明规则禁止破坏已存在的标识，不能推出\"无标识即可任意处理\"。"
  ],
  "lesson_summary": "本课讲清了第 4.2 节的一对规则：平台有权依据法规与标准对 AI 内容添加标识，用户不得遮挡、涂抹、修改或删除这些标识。你练习了对具体处理方式的判断，并确认了两点边界——标识的具体形式不在本课证据范围，\"有权添加\"不等于\"一定添加\"。",
  "limitations": "只覆盖 P14 第 4.2 节所选命题；不判断具体标识形式与技术实现，不表示平台一定添加标识；不覆盖标识以外的内容发布规则；本课不引入任何未验证的界面、按钮或功能。",
  "status": "full_course"
}
