{
  "lesson_id": "JCA-M02-L03",
  "module_id": "JCA-M02",
  "title": "Seedream 模型能力与图片产品流程的范围分离",
  "lesson_role": "CONCEPT",
  "scope": "ByteDance Seed Model Layer 的 Seedream 5.0 Pro 能力声明，以及它们与本 Track 图片产品流程之间的边界；不含产品操作步骤。",
  "learner_outcomes": [
    "区分 Seedream 模型层能力声明与图片产品流程步骤",
    "解释产品流程证据不能证明模型能力，模型能力也不能证明产品可用"
  ],
  "knowledge_refs": [
    "JIM-K-0004",
    "JIM-K-0005",
    "JIM-K-0006",
    "JIM-K-0007",
    "JIM-K-0008"
  ],
  "graph_support_refs": [],
  "opening": "前两课你已经在界面上完成了图片生成与导出。这一课不加新操作，只做一件事：**把\"模型能做什么\"和\"你在界面上怎么做\"分开**。这两件事都属于图片创作，但它们的依据完全不同，混在一起会让你在遇到\"界面里找不到某功能\"时误判成\"系统出错\"。",
  "teaching_points": [
    {
      "point_id": "M02-L03-P01",
      "knowledge_refs": ["JIM-K-0004", "JIM-K-0007", "JIM-K-0008"],
      "explanation": "先看清模型层声明长什么样。Seedream 5.0 Pro 的官方说明列出了几项能力：支持生成包含较多文字的图像、图层分离、多语言图像生成。注意这些句子的共同特征——它们说的是\"该模型能做什么\"，而不是\"在某产品的某个界面点哪里\"。每一条的 scope 都写着同一句话：**ByteDance Seed Model Layer；仅官方模型能力说明，不代表即梦产品已部署或开放。** 这句话不是免责套话，它是这条知识的一部分。",
      "scope_note": "只复述模型层能力声明；不推导产品端入口、按钮、参数或部署状态。"
    },
    {
      "point_id": "M02-L03-P02",
      "knowledge_refs": ["JIM-K-0005", "JIM-K-0006"],
      "explanation": "再看两条交互编辑类的能力：支持响应空间标注进行交互编辑、支持草图引导的交互编辑。这两条最容易被误读——因为\"交互\"听起来就像界面操作。但它们的 limitations 明确写着：不推导标注格式、坐标参数、像素精度或即梦 UI（对应空间标注条）；不补充草图制作方法、格式或产品端操作（对应草图条）。所以\"模型支持空间标注引导\"**不能**推出\"即梦界面上有一个标注工具、你知道怎么用它\"。",
      "scope_note": "只说明模型层能力的存在；不推导任何产品端交互方式、标注格式或操作步骤。"
    },
    {
      "point_id": "M02-L03-P03",
      "knowledge_refs": ["JIM-K-0004", "JIM-K-0005", "JIM-K-0006", "JIM-K-0007", "JIM-K-0008"],
      "explanation": "由此得到一个双向的判断纪律：**产品流程证据不能证明模型能力，模型能力也不能证明产品可用**。前一句的意思是——你在界面上顺利完成了一次操作，只能说明那个流程成立，不能推出底层模型具备某项被官方列出的能力；后一句的意思是——官方列出了某项模型能力，不能推出即梦端已部署或你的账号已开放。两边都只能在自己的层内成立。本 Module 前两课的证据属于产品层，本课的五条引用属于模型层，两者不会被合并。",
      "scope_note": "该纪律用于防止跨层互推；不表示模型能力与产品功能之间不存在工程关系，只表示本条知识不支持由一方推出另一方。"
    }
  ],
  "guided_practice": "`PEDAGOGICAL_EXAMPLE`（以下五条为教学示例，用于示范归类，不是原文照抄）：给出五句关于图片能力的话，其中若干句读起来像界面操作（例如\"可以用标注指定要改的区域\"），若干句像能力定位（例如\"支持某类图像生成\"）。在引导下逐句判断它属于模型层声明还是产品流程步骤，并对每句写一句\"它不能推出什么\"。",
  "independent_practice": "不看判断纪律，自己写出两条规则：一条说明\"为什么我在界面上做到了某事，不能用来证明模型具备某能力\"，另一条说明\"为什么官方列出某模型能力，不能用来证明我能用上它\"。要求：不引用任何具体按钮、参数或部署状态。",
  "completion_check": "学生能正确区分模型层能力声明与产品流程步骤，并能用一句话分别说出两个方向的\"不能推出\"。",
  "boundaries_and_misconceptions": [
    "把\"支持空间标注进行交互编辑\"读成\"界面上有标注工具\"。模型层声明不推导产品端交互方式与参数。",
    "把\"支持草图引导\"读成\"知道怎么画草图、草图的格式是什么\"。这些均不在本课证据范围。",
    "用自己的操作成功经验反推模型能力。产品流程证据只在产品层成立。",
    "反过来用模型能力声明宣告产品可用。模型层 scope 明确不代表产品已部署或开放。",
    "以为\"图层分离\"意味着知道图层数量或文件格式。本条 limitations 明确不推导这些。"
  ],
  "lesson_summary": "本课把模型层与本 Track 的产品流程分开：生成类能力（文字密集图像、图层分离、多语言生成）与交互类能力（空间标注、草图引导）都是模型层声明，每条自带\"不代表即梦产品已部署或开放\"的范围说明。你练习了双向判断纪律——产品流程证据不能证明模型能力，模型能力也不能证明产品可用。",
  "limitations": "只覆盖 Seedream 5.0 Pro 的官方模型能力说明；不覆盖完整模型菜单、模型参数、效果保证或任何产品端操作；不判断即梦端是否已部署任何具体能力；本课不含界面步骤。",
  "status": "full_course"
}
