{
  "lesson_id": "JCA-M04-L02",
  "module_id": "JCA-M04",
  "title": "视频提示词的组织与主体不清楚时的修订",
  "lesson_role": "PROCEDURE",
  "scope": "Jimeng Product Layer；官方视频生成器 FAQ 的基础表达建议（组织方法与主体不清时的补足）。",
  "learner_outcomes": [
    "输入按官方建议组织的视频提示词",
    "在主体表达不清楚时补充描述并完成一次修订"
  ],
  "knowledge_refs": ["JIM-K-0047", "JIM-K-0048"],
  "graph_support_refs": [],
  "opening": "上一课知道了提示词的四个描述方向，这一课进入具体组织方式，以及一句最常用的补救动作：主体不清楚时怎么办。",
  "teaching_points": [
    {
      "point_id": "M04-L02-P01",
      "knowledge_refs": ["JIM-K-0047"],
      "explanation": "官方视频生成器 FAQ 建议用**主体、场景、动作、运镜和光线**来组织基础提示词。注意它与上一课的四类描述要素不完全同名——「场景」与「运镜和光线」在这里被单独点出，这是组织建议，不是公式。",
      "scope_note": "2026-10-04 读取的官方建议，未给出适用模型或软件版本；不是效果结论。"
    },
    {
      "point_id": "M04-L02-P02",
      "knowledge_refs": ["JIM-K-0048"],
      "explanation": "当主体不清楚时，官方建议**在描述中补足其外观和位置**。这是一个具体的补救动作：不是重写整句，而是把缺的两项补上。它与上一条来自同一份 FAQ，同样未给出适用模型或版本，也不保证一次成功。",
      "scope_note": "修改建议只说明补足方向（外观和位置）；不保证效果，不含字数与语法规则。"
    }
  ],
  "guided_practice": "`PEDAGOGICAL_EXAMPLE`（教学示例）：在引导下写出一条包含主体、场景、动作、运镜和光线的视频提示词，然后针对一处「主体不清楚」的描述，按补足外观和位置的方式完成一次修订。",
  "independent_practice": "不看组织清单，自己写一条视频提示词，并自查两件事：五个组织要素是否都有着落；如果主体不清楚，你会补哪两项。要求：不得把这份建议写成产品保证或效果承诺。",
  "completion_check": "学生能写出按主体、场景、动作、运镜、光线组织的视频提示词，并能对主体不清楚的描述完成一次补足外观与位置的修订。",
  "boundaries_and_misconceptions": [
    "把 FAQ 建议当成效果保证或一次成功的承诺。",
    "把五个组织要素当成固定顺序或必填公式。",
    "主体不清楚时整句重写，而不是补足外观和位置。",
    "为建议补上适用模型、版本或字数规则。这些都未被说明。"
  ],
  "lesson_summary": "本课给了视频提示词的两条官方基础建议：用主体、场景、动作、运镜和光线组织；主体不清楚时补足其外观和位置。两条都是建议而非保证。",
  "limitations": "只覆盖 2026-10-04 读取的官方 FAQ 基础建议；未给出适用模型或版本；不是效果结论、不保证一次成功；不含教学示例（本课示例为教学自造并已标注）、完整 Prompt 技法、UI 操作或输入参数。",
  "status": "full_course"
}
