{
  "lesson_id": "JCA-M01-L01",
  "module_id": "JCA-M01",
  "title": "产品声明、模型声明与版本记录的区别",
  "lesson_role": "FOUNDATION",
  "scope": "Jimeng Product Layer 与 ByteDance Seed Model Layer 的声明分层；版本记录限官方页面已保存的发布事实与上线声明。",
  "learner_outcomes": [
    "区分同主题下的产品层声明与模型层声明",
    "解释版本记录只说明已保存的历史事实，不证明当前可用性",
    "识别“模型具备该能力”不等于“该账号已开放该功能”"
  ],
  "knowledge_refs": [
    "JIM-K-0001",
    "JIM-K-0014",
    "JIM-K-0036",
    "JIM-K-0038",
    "JIM-K-0042",
    "JIM-K-0043"
  ],
  "graph_support_refs": ["JIM-E-0016", "JIM-E-0018", "JIM-E-0019"],
  "opening": "整个 Track 的第一课不讲操作，讲一件会一直用到的事：**分清谁在什么层说了什么**。同一件事常常有两句听起来很像的话，一句出自模型官方说明，一句出自即梦产品页；它们不是同一句话的两个版本，而是两层不同的声明。这一课建立一个判断习惯，后面每一次看到“支持某能力”时都用得上。",
  "teaching_points": [
    {
      "point_id": "M01-L01-P01",
      "knowledge_refs": ["JIM-K-0001", "JIM-K-0014"],
      "explanation": "看一个真实的分层例子。模型层（Seed 官方）：\"将 Seedance 2.5 描述为音视频联合生成模型\"；产品层（即梦产品页）：\"可以生成带声音的视频，并支持音画协同创作，让对白、音乐、环境氛围和画面节奏共同服务于同一个故事\"。两句主题相近，但**不是同一命题**：模型层那句是能力定位，它自己的 scope 就写明\"不代表即梦产品已部署或开放\"；产品层那句是产品页说明，它自己的 limitations 写明\"产品层音画协同声明不等于底层模型的音视频联合生成技术细节\"。所以正确读法是——两句各自成立，谁也不能替代谁。",
      "scope_note": "只建立\"两句分属不同层\"这一判断；不推断模型能力的产品可用性，也不把产品说明当作模型技术细节。"
    },
    {
      "point_id": "M01-L01-P02",
      "knowledge_refs": ["JIM-K-0036", "JIM-K-0038"],
      "explanation": "再看版本记录。官方发布页记载：Seedance 2.5 于 **2026-07-31** 正式发布，Seedance 2.0 于 **2026-02-12** 正式发布，两者都被称为\"新一代视频创作模型\"。这类记录只说明**宣示的发布日期与版本定位**，它的 limitations 明确写着：不推断该日期之后是否修订、不代表所有端或账号同步开放、也不说明其它版本是否因此变更状态。因此\"某版本已发布\"不能推出\"你今天能用它\"。",
      "scope_note": "版本记录属 Model Layer 的发布事实；不证明产品端可用性、账号权限或其他版本的状态变化。"
    },
    {
      "point_id": "M01-L01-P03",
      "knowledge_refs": ["JIM-K-0042", "JIM-K-0043"],
      "explanation": "第三层是\"上线声明\"。官方发布页在所述时点记载：Seedance 2.5 已上线即梦 AI（2026-07-31）、Seedance 2.0 已上线即梦 AI（2026-02-12）。这条声明比发布事实更接近产品端，但它仍然**不是**\"所有账号都能用\"：其 limitations 明确不推断所有账号开放、所有地区开放、所有客户端同时开放、当前时点仍保持该状态，也不推断某个版本已被替代或下线。把三层串起来就得到本课的核心判断：**模型具备 ≠ 已发布 ≠ 已上线 ≠ 你的账号已开放**。",
      "scope_note": "上线声明属 Product Layer 的部署声明；不代表账号、地区、客户端范围，也不代表当前时点状态。"
    }
  ],
  "guided_practice": "`PEDAGOGICAL_EXAMPLE`（以下为教学示例，用一句自造的声明示范判断，不是任何真实产品声明）：给出三句话——①\"某模型官方说明支持某某生成方式\"；②\"官方发布页记载某版本于某日发布\"；③\"官方发布页记载某版本已上线某产品\"。在引导下为每句标注它属于哪一层（模型层声明 / 发布事实 / 上线声明），并写出一句\"这句话不能推出什么\"。",
  "independent_practice": "不看分层清单，自己找出一组\"听起来很像\"的模型层与产品层说法（可以回忆本课程前面见过的例子），写出它们的层次，并各写一条不能推出的结论。要求：不得编造任何具体的产品功能、按钮或权限。",
  "completion_check": "学生能对给定声明完成层次标注，并为每层至少写出一条\"不能推出\"的结论，包括明确说出\"模型具备该能力不等于该账号已开放\"。",
  "boundaries_and_misconceptions": [
    "把模型层能力声明当作产品已部署的证据。模型层 scope 明确\"不代表即梦产品已部署或开放\"。",
    "把版本发布事实当作当前可用性。发布日期只记录宣示的事实，不推断后续状态。",
    "把上线声明当作全部账号/地区/客户端均已开放。该声明不推断这些范围。",
    "从措辞相似推出两个不同层的命题是同一件事。相似不等于同一，本课的分层判断正是为了防这一点。"
  ],
  "lesson_summary": "本课建立了全课程第一个判断习惯：把一句话放回它所属的层。你看了三组真实例子——模型层的能力定位、模型层/产品层的版本记录、产品层的上线声明——并练习了对每层写出\"不能推出什么\"。核心结论是四个不等号：模型具备 ≠ 已发布 ≠ 已上线 ≠ 你的账号已开放。",
  "limitations": "只使用仓库已保存的官方声明与发布页记载；版本记录限所存时点，不推断后续修订；不提供完整模型菜单、不判断任何账号的实际开放状态；本课不含任何产品操作步骤。",
  "status": "full_course"
}
