{
  "lesson_id": "JCA-M03-L01",
  "module_id": "JCA-M03",
  "title": "视频生成三步流程与第一步",
  "lesson_role": "PROCEDURE",
  "scope": "即梦 Seedance 2.5 公开产品页所述三步流程结构与第一步职责，以及 2026-10-04 观察到的视频生成界面。",
  "learner_outcomes": [
    "解释视频生成三步流程及产物",
    "解释第一步的职责"
  ],
  "knowledge_refs": ["JIM-K-0009", "JIM-K-0010", "JIM-K-0012", "JIM-K-0024"],
  "graph_support_refs": ["JIM-E-0023"],
  "opening": "从这一课起进入视频链路。先看清整条流程的形状，再进入第一步——因为视频生成的每一步都比图片链路多了几个决定，先有全貌才不容易走偏。",
  "teaching_points": [
    {
      "point_id": "M03-L01-P01",
      "knowledge_refs": ["JIM-K-0009", "JIM-K-0024"],
      "explanation": "即梦 Seedance 2.5 公开产品页把视频生成说明为三个步骤：**打开AI视频生成器**、**上传素材并输入提示词**、**生成预览并保存**。产品页把生成流程组织为这个三步结构，并且写明该流程的产物是**可下载的 AI 视频**。先记住产物：你最终要拿到的是一个可下载的成品，而不是一段留在界面里的预览。",
      "scope_note": "仅为产品页概述的流程结构；不含按钮位置、界面布局、耗时、队列或失败重试规则；不承诺生成效果，也不证明所有账号的实时界面一致。"
    },
    {
      "point_id": "M03-L01-P02",
      "knowledge_refs": ["JIM-K-0010"],
      "explanation": "第一步的职责是：**进入即梦的 AI 视频工具，并选择 Seedance 2.5 模型**。这一步的关键在「选择模型」——它说明模型不是自动确定的，而是流程里的一个动作。同时注意边界：证据没有说明 Seedance 2.5 是否为该工具的默认模型，也没有说明还有哪些可选模型。所以在没有证据之前，不要替界面补上「默认就是它」或「只能选它」这类结论。",
      "scope_note": "不提供工具入口的完整 URL 结构、按钮文案与界面跳转细节；不说明 Seedance 2.5 是否为默认模型或其他可选模型。"
    },
    {
      "point_id": "M03-L01-P03",
      "knowledge_refs": ["JIM-K-0012"],
      "explanation": "第一步之后你会面对两种基础输入方式：**直接输入文字提示词**生成视频，或**上传图片作为视觉参考**生成视频。这两条是并列的基础输入方式，不是同一步骤的两个阶段。至于图片的格式、数量、分辨率，以及上传后主体是否保持一致，证据都没有说明——这些属于「未说明」，不是「可以随便用」。",
      "scope_note": "同句还提到组合脚本、视频、音频和风格素材的多模态创作，该部分另立条目，不并入本条；本条不说明图片格式、数量、分辨率或主体一致性保证。"
    }
  ],
  "guided_practice": "`PEDAGOGICAL_EXAMPLE`（以下为教学示例）：在引导下按顺序完成三件事——①说出这条流程的三个步骤与最终产物；②指出第一步包含哪两个动作（进入工具、选择模型）；③说出两种基础输入方式的名称，并各举一个你会用它的理由。不强求在界面上完成完整生成。",
  "independent_practice": "不看流程清单，自己写出三步结构、产物、第一步的两个动作，并回答：如果别人说「这个工具默认就是 Seedance 2.5，不用选」，你依据什么判断这句话能不能信。",
  "completion_check": "学生能按顺序说出三步流程并指出产物为可下载的 AI 视频，能说明第一步包含「进入工具」与「选择模型」两个动作，并能指出「是否为默认模型」在证据上未被说明。",
  "boundaries_and_misconceptions": [
    "把三步结构当成界面按钮的位置说明。它只是流程概述。",
    "认定 Seedance 2.5 是默认模型或唯一可选模型。证据未说明。",
    "把「上传图片作视觉参考」与「输入文字提示词」当成同一步骤的两个阶段，或互相替代。",
    "把「可下载的 AI 视频」扩大成画质、时长或效果保证。",
    "为流程补上耗时、队列或失败重试规则。这些均不在证据范围。"
  ],
  "lesson_summary": "本课建立了视频链路的全貌：三步结构（打开 AI 视频生成器 → 上传素材并输入提示词 → 生成预览并保存）与产物（可下载的 AI 视频），并细看了第一步的两个动作——进入工具、选择模型——以及两种基础输入方式。同时确认了三处「证据未说明」：是否默认模型、图片规格、主体一致性。",
  "limitations": "只覆盖该公开产品页所述流程与该时点的界面观察；不含按钮位置、界面布局、耗时、队列、失败重试、素材规格与效果承诺；不证明所有账号的实时界面一致；本课不含完整操作演练。",
  "status": "full_course"
}
