{
  "lesson_id": "JCA-M03-L02",
  "module_id": "JCA-M03",
  "title": "第二步：素材与提示词输入",
  "lesson_role": "PROCEDURE",
  "scope": "即梦 Seedance 2.5 公开产品页所述第二步的输入内容；产品层描述。",
  "learner_outcomes": [
    "解释第二步允许的输入类型",
    "解释提示词在该步骤中的职责"
  ],
  "knowledge_refs": ["JIM-K-0011", "JIM-K-0014"],
  "graph_support_refs": ["JIM-E-0004", "JIM-E-0024"],
  "opening": "上一课看清了第一步。这一课处理第二步：素材与提示词。注意产品页把这两件事放在**同一步骤**里——它们不是先后两关，而是一次输入的两个部分。",
  "teaching_points": [
    {
      "point_id": "M03-L02-P01",
      "knowledge_refs": ["JIM-K-0011"],
      "explanation": "产品页把「上传素材」与「输入提示词」列为同一步骤：可以添加参考图片或视频，并用提示词描述**主体、动作、镜头和视觉风格**。所以这一步有两条并行的输入线：一条给素材，一条给文字描述。至于提示词该怎么写、写多长、用什么句式，以及素材的数量、格式、大小与时长——这些证据都没有给出。",
      "scope_note": "不给出提示词结构、字数、语法或示例，也不包含素材数量、格式、大小与时长等数值规格。"
    },
    {
      "point_id": "M03-L02-P02",
      "knowledge_refs": ["JIM-K-0014"],
      "explanation": "这一步还牵涉到产品层对声音的说明：即梦产品页写明 Seedance 2.5 可以生成**带声音的视频**，并支持**音画协同创作**——让对白、音乐、环境氛围和画面节奏共同服务于同一个故事。这里必须分清两句话：这是**产品层**的功能说明，它自己的边界写明「不等于底层模型的音视频联合生成技术细节」，也不承诺声音与画面的一致性效果，更不说明音频上传方式、格式、时长、语言与口型同步精度。",
      "scope_note": "产品层音画协同声明不等于模型技术细节；不说明音频上传方式与格式，也不承诺声音与画面的最终一致性。"
    }
  ],
  "guided_practice": "`PEDAGOGICAL_EXAMPLE`（教学示例）：给出一段创作意图（例如「一位骑手在雨夜穿过街口」），在引导下做两件事——①指出这一步需要准备的两类输入（素材、提示词）；②按主体、动作、镜头、视觉风格四项，写出你会怎么描述它。",
  "independent_practice": "不看四项清单，自己写出一句覆盖主体、动作、镜头与视觉风格的描述，并回答：产品页说「可以生成带声音的视频」，你能不能用这句话推断「我可以单独上传一段音频」？说明理由。",
  "completion_check": "学生能说明第二步包含「上传素材」与「输入提示词」两条并行输入线，能说出提示词需要描述的四类要素，并能指出音画协同是产品层说明、不证明音频上传方式存在。",
  "boundaries_and_misconceptions": [
    "把素材与提示词当成先后两关，而不是同一步骤的两条输入线。",
    "把「可以生成带声音的视频」推断成「有音频上传入口」或「口型一定同步」。",
    "把产品层音画协同声明当成模型技术细节。两者分属不同层。",
    "为提示词补上结构、字数或示例，为素材补上格式与时长规格。这些均未被证据说明。"
  ],
  "lesson_summary": "本课讲清了第二步的两条并行输入线——上传素材（参考图片或视频）与输入提示词（描述主体、动作、镜头、视觉风格），并区分了音画协同这一产品层说明与模型技术细节，同时记录了三处「证据未说明」。",
  "limitations": "只覆盖该产品页所述第二步；不含提示词写法细节、素材数值规格、音频上传方式与格式；不承诺声音与画面一致性；本课不含界面按钮位置与操作演练。",
  "status": "full_course"
}
