{
  "lesson_id": "JCA-M08-L01",
  "module_id": "JCA-M08",
  "title": "创作准备：入口、准入与任务目标",
  "lesson_role": "INTEGRATION",
  "scope": "Jimeng Web 2026-10-04 观察到的创作入口与准入范围，以及本课要求的任务目标设定。",
  "learner_outcomes": [
    "识别创作入口并按需要完成登录准入",
    "说明本次创作的目标与可交付结果"
  ],
  "knowledge_refs": ["JIM-K-0054", "JIM-K-0055", "JIM-K-0056"],
  "graph_support_refs": [],
  "opening": "综合模块开始。它与其他模块的区别是：这里不再教新知识，而是把已经学过的串起来用。第一件事是准备——进得去、说清要做什么。",
  "teaching_points": [
    {
      "point_id": "M08-L01-P01",
      "knowledge_refs": ["JIM-K-0054"],
      "explanation": "先认出起点画面：未登录创作首页上有「创作」导航区域、「生成」与「画布」两个入口标签，以及显示「你好，今天想要创作什么？」的主创作输入区。这一步不需要新技能，只需要在真实界面上**指对位置**。",
      "scope_note": "来自单次未登录状态观察；不证明这些名称与入口在其他客户端、账号或时点一致。"
    },
    {
      "point_id": "M08-L01-P02",
      "knowledge_refs": ["JIM-K-0055", "JIM-K-0056"],
      "explanation": "未登录时「对话」与「画布」区域显示「请先登录」，页面存在「登录」入口；进入创作区域的最小路径为：打开官方 Web → 进入「创作」区域 → 若要用当前的「对话」或「画布」区域，页面提示需先登录 → 通过「登录」入口完成准入 → 回到创作首页 → 识别「生成」「画布」入口 → 在主创作输入区开始创作。注意这条提示**不等于**协议要求的真实身份信息认证。",
      "scope_note": "登录之后的具体按钮路径未在截图中显示，因此未记录为证据；不含 iOS/Android 路径与权限条件。"
    },
    {
      "point_id": "M08-L01-P03",
      "knowledge_refs": ["JIM-K-0056"],
      "explanation": "准备阶段的第二个动作是**把目标写下来**：用一句话说明你这次要做什么，以及你要拿到什么可交付结果（例如一张图片或一段视频）。这不是产品功能，而是本课程的方法要求——先有目标，后面的提示词与结果判断才有依据。有了这句目标，你才可能在最后一课回答「这次修改是为了什么」。",
      "scope_note": "目标设定属课程方法要求，不是产品行为或界面能力。"
    }
  ],
  "guided_practice": "`PEDAGOGICAL_EXAMPLE`（教学示例）：在已证实的界面上完成准备——①进入创作区域；②识别「生成」「画布」入口；③按需要完成登录准入；④写下一句本次创作目标与预期交付物。完成后口头复述你的路径。",
  "independent_practice": "不看路径说明，自己完成进入创作区域并写出本次创作目标与可交付结果；然后回答：如果别人说「未登录时什么都不能用」，你依据本课的证据会怎么纠正他？",
  "completion_check": "学生能进入创作区域、按需要完成登录准入，并写出本次创作目标与预期可交付结果。",
  "boundaries_and_misconceptions": [
    "把「请先登录」当成协议要求的真实身份信息认证。两者不同层、不同要求。",
    "把登录后的具体按钮路径当成已验证步骤。截图未显示。",
    "跳过目标设定直接开始操作，导致后面无法判断结果是否可用。",
    "把「未登录时『对话』『画布』不开放」扩大成「未登录时什么都不能用」。"
  ],
  "lesson_summary": "本课完成了综合创作前的准备：认出创作区域与两个入口、完成登录准入、记住最小路径，并写下一句可交付的创作目标。同时确认「请先登录」不等于真实身份认证要求。",
  "limitations": "只覆盖 2026-10-04 的单次未登录 Web 观察；不含登录后页面结构、iOS/Android 路径、会员/积分/价格/权限条件；不推断名称永久不变；本课不含创作操作步骤。",
  "status": "full_course"
}
