{
  "lesson_id": "JCA-M06-L02",
  "module_id": "JCA-M06",
  "title": "图片修改任务的执行与交付",
  "lesson_role": "PROCEDURE",
  "scope": "2026-10-04 观察到的 Jimeng Web / Seedream 5.0 Pro 图片修改任务的提交、复查与交付，以及结果页可见入口的验证状态。",
  "learner_outcomes": [
    "输入一次针对已有图片的局部修改要求并提交执行",
    "检查修改结果并完成下载，或选择重新编辑、再次生成",
    "解释“局部重绘”等只是结果页可见入口，其内部步骤尚未验证",
    "解释“其他保持不变”是修改要求，不是产品保证"
  ],
  "knowledge_refs": ["JIM-K-0060", "JIM-K-0061"],
  "graph_support_refs": ["CRR2-E-0007"],
  "opening": "上一课理解了局部编辑的能力与边界。这一课动手：对一张已有图片提出一次修改要求，提交、复查、交付。这里有两句话必须说准——一句是「其他保持不变」，一句是关于那些看得到但没验证过的入口。",
  "teaching_points": [
    {
      "point_id": "M06-L02-P01",
      "knowledge_refs": ["JIM-K-0060"],
      "explanation": "在 2026-10-04 观察到的已登录图片生成界面中，一次修改任务按这个顺序进行：**加载已有图片 → 在输入框中写明修改要求 → 经输入框右侧的执行入口提交 → 由 Seedream 5.0 Pro 生成修改后的结果 → 在结果页查看结果，可重新编辑或再次生成 → 下载结果**。该次任务的要求是「只把人物上衣改成蓝色，其他保持不变」。",
      "scope_note": "scope 限 Jimeng Web、限该截图时点、限 Seedream 5.0 Pro 图片链路；不含系统文件选择器步骤与素材格式/大小/时长条件。"
    },
    {
      "point_id": "M06-L02-P02",
      "knowledge_refs": ["JIM-K-0060"],
      "explanation": "「**其他保持不变**」这句话必须标清性质：它是**用户提出的修改目标**，不是产品保证。因此不得据此写成「只会修改目标区域、其它一定不变」。同理，证据也不说明提交后是否必然产生可用结果，以及生成耗时、额度或权限。",
      "scope_note": "该要求是用户侧表述；不代表产品行为承诺，也不代表保留要素一定一致。"
    },
    {
      "point_id": "M06-L02-P03",
      "knowledge_refs": ["JIM-K-0061"],
      "explanation": "任务完成后，结果页显示修改后的图片预览，并提供**「重新编辑」「再次生成」与「下载」**；结果详情页同时可见「去画布编辑」「局部重绘」「智能改图」「细节修复」「扩图」「消除笔」等**入口文字**。关键纪律：这些子工具只被验证为**结果页中的可见入口**，其内部操作步骤**未被验证**（状态为「未验证」，**不是**「不支持」）。另外，本证据没有验证 Seedance 2.5 的视频编辑。",
      "scope_note": "不写成这些子工具的完整流程；不保证结果在保真度或保留要素上的一致性；不表示所有账号/地区/版本拥有同样界面。"
    }
  ],
  "guided_practice": "`PEDAGOGICAL_EXAMPLE`（教学示例）：在已证实的界面上对一张已有图片提交一次局部修改要求，然后在结果页完成一次复查与下载；完成后指出你看到过哪些入口文字，并说明它们各自被验证到什么程度。",
  "independent_practice": "不看顺序清单，自己写出一次修改任务的完整顺序，并完成两处改写：①把「其他保持不变」改写成符合证据的表述；②把「局部重绘能这样做」改写成符合证据的表述。各说明理由。",
  "completion_check": "学生能按顺序完成一次图片修改任务并交付结果，能说明「其他保持不变」是用户修改目标而非产品保证，并能说明结果页子工具入口的内部步骤处于「未验证」状态。",
  "boundaries_and_misconceptions": [
    "把「其他保持不变」当成产品保证，写成「其它一定不变」。",
    "把「局部重绘」「去画布编辑」等入口文字当作已验证的完整流程。",
    "把「未验证」读成「不支持」。",
    "用本课证据推断 Seedance 2.5 的视频编辑能力。本证据没有验证它。",
    "假定提交后必然产生可用结果，或假定生成耗时、额度与权限。"
  ],
  "lesson_summary": "本课完成了图片修改任务的执行与交付：加载图片、写明要求、提交、生成、复查（可重新编辑或再次生成）、下载；并守住两句表述——「其他保持不变」是用户目标不是保证；结果页子工具只是可见入口，内部步骤未验证。",
  "limitations": "scope 限 Jimeng Web、限 2026-10-04 截图时点、限 Seedream 5.0 Pro 图片链路；本证据未验证 Seedance 2.5 视频编辑；不含文件选择器步骤、素材规格、提交后必然性的保证与耗时/额度/权限信息；子工具内部步骤未验证；不表示所有账号/地区/版本界面一致。",
  "status": "full_course"
}
