{
  "lesson_id": "JCA-M07-L01",
  "module_id": "JCA-M07",
  "title": "输入内容的义务与权属要求",
  "lesson_role": "SAFETY",
  "scope": "平台规则限 P14 所保存的即梦AI 用户服务协议第 4.1 节中与输入信息有关的命题，以及它们对输入动作的使用边界。",
  "learner_outcomes": [
    "识别不得输入或分享未经授权信息的要求",
    "识别输入内容须为本人所有或已获授权、不得侵害他人权益的要求"
  ],
  "knowledge_refs": ["JIM-K-0025", "JIM-K-0026"],
  "graph_support_refs": ["POL-E-0001", "POL-E-0002"],
  "opening": "前面几个模块你已经在界面上做过输入、生成和导出。这一课开始处理一件同样重要的事：**你被允许输入什么**。本课只看所选条款中与\"输入\"有关的义务：一类关于信息的性质（未授权的信息），一类关于内容的权属（是否为本人所有或已获授权）。",
  "teaching_points": [
    {
      "point_id": "M07-L01-P01",
      "knowledge_refs": ["JIM-K-0025"],
      "explanation": "所选条款要求用户不得输入、分享任何未经授权的个人信息、保密信息（包括但不限于商业秘密），以及未经授权的其他类型信息。这条规则限定的对象是**被输入的信息类型**本身，而不是生成结果或界面操作。换句话说，它约束的是\"你在提示词或素材里放了什么\"。",
      "scope_note": "只表达\"该规则约束该输入行为\"；不判断任何具体内容是否违规，也不解释\"未经授权\"的判定标准。"
    },
    {
      "point_id": "M07-L01-P02",
      "knowledge_refs": ["JIM-K-0026"],
      "explanation": "所选条款同时要求用户确保输入内容合法合规、为本人所有或已获得合法授权，并且不得侵害他人的著作权、专利权、商标权、肖像权、姓名权、声音权益、名誉权、荣誉权等权益。这一条与上一条是不同的义务：上一条管\"信息类型能不能进\"，这一条管\"进来的东西你有没有权利用\"。两者可能同时成立，也可能只触及其中一条。",
      "scope_note": "只表达权属与不侵权要求对输入行为的约束；不判断具体素材的权利状态，不提供获得授权的方法，也不构成法律意见。"
    },
    {
      "point_id": "M07-L01-P03",
      "knowledge_refs": ["JIM-K-0025", "JIM-K-0026"],
      "explanation": "把两条义务放在一起，可以得到一个可操作的判断顺序：先问\"这条信息本身是否属于未授权的个人信息、保密信息或其他未授权信息\"，再问\"我提供的内容是否为我所有或已获授权、是否可能侵害他人权益\"。`PEDAGOGICAL_EXAMPLE`：假设你要输入一段背景说明与一张照片，第一问会提示你检查那段说明里是否含有他人的联系方式或内部资料，第二问会提示你确认那张照片是你拍摄的、还是来自他人。这个例子只是示范怎么问，不是产品功能说明。",
      "scope_note": "判断顺序是教学组织方式，不是条款原文的分类；例子仅用于示范提问方式，不作为产品事实。"
    }
  ],
  "guided_practice": "`PEDAGOGICAL_EXAMPLE`（以下三类输入为教学示例，用于示范判断，不是产品功能说明）：①一段包含他人手机号与公司内部编号的说明文字；②一张从网络下载的他人摄影作品；③你自己拍摄的街景照片。在引导下逐项判断它触及哪一条义务（信息类型 / 权属），并用一句话写出判断依据。",
  "independent_practice": "为一次你计划中的创作，自己列出准备输入的清单（不少于 3 项），逐项标注\"是否需要事先确认授权\"，并说明标注理由。不要求真的去取得授权，只要求把判断说清楚。",
  "completion_check": "学生能识别所选条款的输入义务与权属要求，并能对给定输入指出至少一处需要事先确认授权的情形，同时说明依据。",
  "boundaries_and_misconceptions": [
    "不判断具体内容是否违规，也不解释\"未经授权\"的判定标准——本课只说明规则限定了什么。",
    "本条只覆盖 P14 所保存的第 4.1 节命题，不构成完整政策，也不是法律意见。",
    "\"条款没有提到\"不等于\"允许\"；\"我无法确认是否已授权\"也不等于\"已经授权\"。两者都不是同义词。",
    "\"信息类型义务\"与\"权属义务\"是两条不同的义务，不要合并成一条模糊的\"要注意版权\"。"
  ],
  "lesson_summary": "本课把所选条款中与输入有关的两类义务分开讲清了：一类限定被输入信息的类型（未授权的个人信息、保密信息等），一类限定输入内容的权属与不侵权要求。你练习了用两条提问来检查自己准备输入的内容，并确认了这类判断不构成对具体内容的违规认定。",
  "limitations": "只覆盖 P14 第 4.1 节所选命题；不覆盖《社区自律公约》、阈值或后续版本变化；不判断具体内容性质、不解释判定标准、不提供授权取得方式；本课不引入任何未验证的界面或功能。",
  "status": "full_course"
}
