{
  "lesson_id": "JCA-M08-L03",
  "module_id": "JCA-M08",
  "title": "独立完成一次视频创作流程并加入参考素材",
  "lesson_role": "INTEGRATION",
  "scope": "即梦 Seedance 2.5 产品页所述视频流程与 2026-10-04 观察到的视频生成 / 全能参考界面；本课为独立完成，不再提供分步提示。",
  "learner_outcomes": [
    "按流程完成一次视频生成并下载产物",
    "输入与创作意图相符的视频提示词",
    "按已证实路径加入一次参考素材或 @ 引用"
  ],
  "knowledge_refs": ["JIM-K-0009", "JIM-K-0010", "JIM-K-0011", "JIM-K-0046", "JIM-K-0047", "JIM-K-0057"],
  "graph_support_refs": [],
  "opening": "上一课独立完成了图片链路。这一课换成视频链路——它更长、每一步的选择更多，还多了一件图片链路没有的事：参考素材。依然不给分步清单。",
  "teaching_points": [
    {
      "point_id": "M08-L03-P01",
      "knowledge_refs": ["JIM-K-0009", "JIM-K-0010", "JIM-K-0046"],
      "explanation": "先自己重建三步骨架：打开 AI 视频生成器（第一步含**进入工具与选择 Seedance 2.5 模型**两个动作）→ 上传素材并输入提示词 → 生成预览并保存。第三步是「生成、预览并保存」整体：生成 AI 视频、检查效果并完成必要调整、然后下载成片——注意**不要**把它拆成四个官方小步骤。产物是可下载的 AI 视频。",
      "scope_note": "不含按钮位置、界面布局、耗时、队列与失败重试规则；不说明 Seedance 2.5 是否为默认模型。"
    },
    {
      "point_id": "M08-L03-P02",
      "knowledge_refs": ["JIM-K-0011", "JIM-K-0047"],
      "explanation": "输入这一半用视频专项建议：素材与提示词属**同一步骤**；提示词按官方 FAQ 建议用**主体、场景、动作、运镜和光线**组织；若主体不清楚，补足其**外观和位置**。这些都是建议而非保证，也不含字数与语法规则。",
      "scope_note": "未给出适用模型或软件版本；不是效果结论，不保证一次成功；不含教学示例原文与输入参数。"
    },
    {
      "point_id": "M08-L03-P03",
      "knowledge_refs": ["JIM-K-0057"],
      "explanation": "参考素材按已证实路径加入：进入「生成」→ 选择「视频生成」→ 选择「即梦 Seedance 2.5」→ 选择「全能参考」→ 在「参考内容」处上传参考素材，或在输入中用 **@ 引用**。三处边界照旧：界面显示的「最多50个」是当前界面总量提示（不是分项上限、不是模型上限）；独立音频上传入口**未单独验证**（≠ 不支持）；素材格式与大小条件未验证。",
      "scope_note": "不含系统文件选择器步骤；不表示「全能参考」在所有账号、地区或客户端均可用；来自单次观察，不证明路径在其它版本不变。"
    }
  ],
  "guided_practice": "`PEDAGOGICAL_EXAMPLE`（教学示例）：在一次课内独立完成——①写出视频创作目标；②按五点组织写一条视频提示词；③走完三步流程触发生成；④按已证实路径加入一次参考素材或 @ 引用；⑤下载产物。完成后复述你的动作顺序。",
  "independent_practice": "不看任何清单，独立完成第二次视频创作并加入一次参考素材，然后写下三段说明：你的目标是什么；你的提示词如何覆盖主体、场景、动作、运镜与光线；你加的参考素材属于哪类用途。要求：不得编造未验证的入口、参数或素材规格。",
  "completion_check": "学生能独立完成一次视频创作（目标 → 提示词 → 触发 → 参考素材 → 下载），能说明其提示词的组织依据与所用参考素材的用途。",
  "boundaries_and_misconceptions": [
    "把第三步拆成生成/检查/调整/下载四个官方步骤。",
    "把界面「最多50个」当成图片或视频的分项上限、或当成模型技术上限。",
    "把「未单独验证音频上传入口」说成「不支持音频」。",
    "为素材补上格式、大小与时长规格。这些均未被验证。",
    "认定 Seedance 2.5 是默认模型或唯一可选模型。"
  ],
  "lesson_summary": "本课完成了第一次独立视频创作：重建三步流程、按五点组织提示词、触发生成、按已证实路径加入参考素材或 @ 引用、下载产物。此前学过的全部边界都被带进了实际操作。",
  "limitations": "只覆盖该产品页所述流程与 2026-10-04 的观察界面；不含按钮位置、耗时、队列、失败重试、素材规格、分项数量条件与效果承诺；不证明所有账号/地区/客户端一致；本课不含作业系统或评分标准。",
  "status": "full_course"
}
