{
  "lesson_id": "JCA-M05-L02",
  "module_id": "JCA-M05",
  "title": "参考内容的加入路径与总量提示",
  "lesson_role": "PROCEDURE",
  "scope": "2026-10-04 观察到的 Jimeng Web 视频生成 / Seedance 2.5 / 全能参考界面中的加入路径、总量提示与引用方式。",
  "learner_outcomes": [
    "解释“全能参考”下“参考内容”的加入路径",
    "解释界面显示的参考素材总量提示，并说明它不是分类型上限",
    "解释当前界面涉及的图、文、音、视频多元素组合与 @ 引用方式"
  ],
  "knowledge_refs": ["JIM-K-0057", "JIM-K-0058", "JIM-K-0059", "JIM-K-0011", "JIM-K-0014"],
  "graph_support_refs": ["CRR2-E-0006"],
  "opening": "上一课知道了有哪几类参考方式，这一课走到界面上：入口在哪、能加多少、以及 @ 引用怎么写。这里有一个数字最容易被讲错——「50」。",
  "teaching_points": [
    {
      "point_id": "M05-L02-P01",
      "knowledge_refs": ["JIM-K-0057", "JIM-K-0011"],
      "explanation": "在 2026-10-04 观察到的已登录界面中，使用「全能参考」加入参考内容的路径是：进入「生成」→ 选择「视频生成」→ 选择「即梦 Seedance 2.5」→ 选择「全能参考」→ 在主输入区的「参考内容」处上传参考素材，**或在输入中用 @ 引用参考内容**。这条路径与产品页把「上传素材」和「输入提示词」并列为同一步骤是一致的。",
      "scope_note": "不含系统文件选择器步骤（截图未显示）、素材格式/大小/时长/分项数量条件、积分会员价格权限；不表示该方式在所有账号、地区或客户端均可用；来自单次观察。"
    },
    {
      "point_id": "M05-L02-P02",
      "knowledge_refs": ["JIM-K-0059"],
      "explanation": "「参考内容」处显示 **「上传最多50个参考素材」**。这个 50 有两条必须守住的边界：它是**当前产品界面**显示的总量提示，**不是** Seedance 2.5 模型层的永久技术上限；它也**不得**改写为「图片最多50张」「视频最多50段」或「音频最多50条」这类分项上限。证据同样没有说明超出之后的行为、计数方式，以及三类素材是否共用同一配额。",
      "scope_note": "该数值只属当前界面与时点；不表示其它账号、地区、客户端或后续版本保持同一数值。"
    },
    {
      "point_id": "M05-L02-P03",
      "knowledge_refs": ["JIM-K-0058", "JIM-K-0014"],
      "explanation": "该界面的「参考内容」说明写明可以**输入文字或 @ 参考内容**，并自由组合**图、文、音、视频**多元素；示例同时给出 @图片1、@视频1 与 @音频1 三种引用，其中 @音频1 对应「音色参考」，@视频1 在被 @图片1 模仿其动作的示例中作为动作参考对象。**关键边界**：示例中的 @音频1 与「音色参考」**不证明存在独立的音频上传入口**——独立音频上传路径未由该截图单独验证，该状态为「未单独验证」，**不等于「不支持」**。",
      "scope_note": "不表示三类素材拥有相同格式/大小/时长条件；不扩大为所有视觉或音频控制能力；产品层音画协同声明不等于模型技术细节。"
    }
  ],
  "guided_practice": "`PEDAGOGICAL_EXAMPLE`（教学示例）：在已证实的界面上找到「参考内容」入口，按路径完成一次参考素材加入；然后在输入中写出一次 @ 引用。完成后回答：「最多50个」指的是什么范围？",
  "independent_practice": "不看路径清单，自己写出加入参考内容的路径，并做两处纠错练习：①改写「图片最多50张」；②改写「这个界面不支持上传音频」。各写出为什么原说法不成立。",
  "completion_check": "学生能说出加入参考内容的路径、解释 50 是界面总量提示而非分项上限或模型上限，并正确说明独立音频上传入口处于「未单独验证」而不是「不支持」。",
  "boundaries_and_misconceptions": [
    "把「最多50个参考素材」写成图片/视频/音频各自的上限。",
    "把界面显示的 50 当成 Seedance 2.5 模型层的永久技术上限。",
    "把 @音频1 与「音色参考」当成独立音频上传入口已被验证。",
    "把「未单独验证」读成「不支持」。两者不同。",
    "假定该路径在所有账号、地区、客户端与版本保持不变。"
  ],
  "lesson_summary": "本课走通了参考内容的加入路径（生成 → 视频生成 → Seedance 2.5 → 全能参考 → 参考内容上传或 @ 引用），并守住两条表述纪律：50 是当前界面的总量提示而非分项或模型上限；独立音频上传入口为「未单独验证」而非「不支持」。",
  "limitations": "只覆盖 2026-10-04 的单次已登录界面观察与产品页说明；不含文件选择器步骤、素材格式/大小/时长/分项数量条件、积分会员价格权限、超出上限后的行为与计数方式；不证明其它版本或账号界面一致；本课不含完整 UI 导览。",
  "status": "full_course"
}
