{
  "lesson_id": "JCA-M06-L01",
  "module_id": "JCA-M06",
  "title": "局部编辑的能力与保留边界",
  "lesson_role": "CONCEPT",
  "scope": "Jimeng Product Layer 的“局部编辑”能力与保留边界；同时标注 ByteDance Seed Model Layer 的编辑能力属模型层。",
  "learner_outcomes": [
    "解释局部编辑只修改局部、无需重新生成整段视频的产品说明",
    "解释修改与保留边界要求（保留原有构图、光影、音频、动作与时间线连续性）",
    "区分模型层编辑能力与产品层编辑功能"
  ],
  "knowledge_refs": ["JIM-K-0016", "JIM-K-0019", "JIM-K-0021", "JIM-K-0003", "JIM-K-0005", "JIM-K-0006", "JIM-K-0007"],
  "graph_support_refs": ["JIM-E-0005"],
  "opening": "编辑这一块最容易把两层混在一起：产品页讲的「局部编辑」，和模型官方列出的几项编辑能力，说的是两件事。这一课先把它们分开，再看保留边界意味着什么。",
  "teaching_points": [
    {
      "point_id": "M06-L01-P01",
      "knowledge_refs": ["JIM-K-0019", "JIM-K-0016"],
      "explanation": "产品页中「**局部编辑**」指**只修改视频局部、而不重新生成整段视频**的编辑方式。它的典型用途是替换错误物体或优化人物细节。理解要点在于「不重新生成整段」——这是它区别于重做的核心。",
      "scope_note": "仅是产品概念与用途说明；不包含操作入口、选区方式与可编辑范围。"
    },
    {
      "point_id": "M06-L01-P02",
      "knowledge_refs": ["JIM-K-0021"],
      "explanation": "产品页同时给出**保留边界**：修改对象限于「替换错误物体」或「优化人物细节」，并声明保留原有**构图、光影、音频、动作和时间线连续性**。注意它的性质——这是**适用范围边界，不是实测保证**：不保证保留要素在每次编辑中都一致，也不说明超出该举例范围的其他编辑对象是否受支持。",
      "scope_note": "是适用范围边界而非保证；不保证保留要素实测一致性；不说明举例范围之外的对象是否受支持。"
    },
    {
      "point_id": "M06-L01-P03",
      "knowledge_refs": ["JIM-K-0003", "JIM-K-0005", "JIM-K-0006", "JIM-K-0007"],
      "explanation": "模型层另有几项编辑相关能力：**绿幕编辑**、**空间标注引导的交互编辑**、**草图引导的交互编辑**、**图层分离**。它们与产品层的「局部编辑」**分别记录、不合并**：模型层声明说的是模型能力，它自己的范围说明就写明「不代表即梦产品已部署或开放」，也不推导标注格式、坐标参数、像素精度或即梦界面。",
      "scope_note": "模型层能力声明不推导产品端入口与操作方式；不解释绿幕处理机制或即梦入口；不推导图层数量与文件格式。"
    }
  ],
  "guided_practice": "`PEDAGOGICAL_EXAMPLE`（教学示例）：给出四句编辑相关说法（两句来自产品页语义、两句来自模型层能力），在引导下逐句判断属于产品层还是模型层，并对产品层那句写出它的保留边界。",
  "independent_practice": "不看分层说明，自己写出「局部编辑」的概念、修改对象范围与保留要素清单，并回答：模型层列出的「图层分离」能不能说明界面上有图层功能？为什么？",
  "completion_check": "学生能解释局部编辑「只改局部、不重新生成整段」并说出修改对象范围与五项保留要素，同时能区分产品层编辑功能与模型层编辑能力。",
  "boundaries_and_misconceptions": [
    "把保留边界当成每次编辑都成立的保证。它是适用范围边界。",
    "把模型层的绿幕编辑/空间标注/草图引导/图层分离当成即梦界面上的现有功能。",
    "把「局部编辑」与「重做整段」混为一谈。",
    "为编辑补上操作入口、选区方式、参数与可编辑范围。",
    "以为超出举例范围的编辑对象一定受支持。证据未说明。"
  ],
  "lesson_summary": "本课讲清了产品层「局部编辑」的概念（只改局部、不重新生成整段）、修改对象范围（替换错误物体、优化人物细节）与五项保留边界（构图、光影、音频、动作、时间线连续性），并把模型层四项编辑能力与之分开记录。",
  "limitations": "只覆盖该产品页对局部编辑的说明与模型层官方能力声明；不含操作入口、选区方式、参数、可编辑范围与实测保留一致性；不推导产品端部署状态；本课不含视频编辑的实测证据。",
  "status": "full_course"
}
