{
  "lesson_id": "JCA-M02-L01",
  "module_id": "JCA-M02",
  "title": "图片生成流程与提示输入",
  "lesson_role": "PROCEDURE",
  "scope": "该官方产品页所述图片生成流程与 2026-10-04 观察到的 Jimeng Web 图片生成界面。",
  "learner_outcomes": ["解释图片生成三步流程及其起点", "输入文本提示并触发一次图片生成"],
  "knowledge_refs": ["JIM-K-0051", "JIM-K-0052"],
  "graph_support_refs": ["CRR2-E-0002"],
  "opening": "夹具。",
  "teaching_points": [{"point_id": "FIX-P01", "knowledge_refs": ["JIM-K-0051"], "explanation": "夹具。", "scope_note": "夹具。"}],
  "guided_practice": "夹具。", "independent_practice": "夹具。",
  "completion_check": "学生能在该界面完成一次提示输入与触发生成，并按顺序说出三步流程及其起点。",
  "boundaries_and_misconceptions": ["夹具。"], "lesson_summary": "夹具。", "limitations": "夹具。",
  "status": "full_course"
}
