{
  "lesson_id": "JCA-M05-L03",
  "module_id": "JCA-M05",
  "title": "参考用途与使用边界",
  "lesson_role": "APPLICATION",
  "scope": "Jimeng Product Layer；即梦 Seedance 2.5 产品页对参考视频与参考图片的用途与作用边界说明，以及音频参考的验证状态。",
  "learner_outcomes": [
    "解释参考视频用于传达动态信息",
    "解释参考图片与参考视频处于参照位置、其作用范围不扩展到其他内容",
    "解释独立音频上传路径未由现有证据单独验证，并不假定该入口存在"
  ],
  "knowledge_refs": ["JIM-K-0015", "JIM-K-0022", "JIM-K-0023"],
  "graph_support_refs": ["JIM-E-0001", "JIM-E-0003"],
  "opening": "上一课你在“全能参考”界面找到了“参考内容”入口。这一课不学新入口，只解决一个更容易出错的问题：**我加的参考素材到底改变了什么**。分不清用途，就会出现\"我传了参考视频，为什么画面风格没按我想要的来\"这类误判。",
  "teaching_points": [
    {
      "point_id": "M05-L03-P01",
      "knowledge_refs": ["JIM-K-0015", "JIM-K-0023"],
      "explanation": "产品页对参考视频的用途说明集中在**动态信息**上：上传参考视频可传达运镜速度、人物轨迹、动作调度和多人互动，用于补足文字提示词难以描述的动态细节。产品页把\"参考生视频\"的用途限定在这一方面——这是用途范围，不是能力上限声明。理解这一点，就能明白参考视频擅长的是\"怎么动\"，而不是\"长什么样\"。",
      "scope_note": "产品页写\"准确控制\"，本课只记录为该发布方的产品层说明，不作为精确复现效果的保证；不说明参考视频的时长、格式、数量或动作迁移精度。"
    },
    {
      "point_id": "M05-L03-P02",
      "knowledge_refs": ["JIM-K-0022"],
      "explanation": "再看两类参考素材各自的角色：上传参考视频与参考图片处于**参照与控制位置**——参考视频用于传达动态信息，参考图片作为视觉参考；产品页未把这两类素材的作用范围扩展到改变生成结果的其他内容。换句话说，参考素材参与的是\"参照\"，不是\"接管\"。这句话同时是一条边界提醒：不要把\"我传了参考\"理解成\"结果由参考决定\"。",
      "scope_note": "这是发布方的作用范围描述，**不等于禁止其他用法**；不推导参考素材与其它输入是否互斥、是否可同时使用，也不说明替代关系。"
    },
    {
      "point_id": "M05-L03-P03",
      "knowledge_refs": ["JIM-K-0015", "JIM-K-0023"],
      "explanation": "最后处理\"它能用在哪儿\"这件事上的两个空位。产品页没有说明：参考视频可否用于非动态用途（例如画面风格或人物外观）；参考视频与文字提示词冲突时的优先级。这两点都属于\"产品页未写\"，而不是\"产品页写了不可以\"。**在证据上的正确处理方式是保留为未知，而不是替它给出结论。** 同样的处理原则也适用于音频参考：上一课已经记录，当前界面里出现的音频引用示例（音色参考）不构成\"存在独立音频上传入口\"的证据，因此那条路径保持\"未被现有证据单独验证\"，不写成\"不支持\"。",
      "scope_note": "只说明两个空位与音频路径的验证状态；不得把\"未说明\"读成\"禁止\"，也不得把\"未验证\"读成\"不支持\"。"
    }
  ],
  "guided_practice": "`PEDAGOGICAL_EXAMPLE`（以下情境为教学示例，用于示范用途判断，不是产品功能说明）：给出四个创作需求——①想让生成结果的动作节奏与某段视频一致；②想让生成结果的画面风格接近某张图；③想让人物的脸与某张图一致；④想确认能否单独上传一段音频。在引导下逐个判断：该需求落在参考视频的动态用途内、落在参考图片的视觉参考内、属于产品页未说明的范围，还是属于未被单独验证的路径，并写出判断依据。",
  "independent_practice": "不看用途清单，自己写一份\"加参考素材前的自检\"：列出三条你会先问自己的问题，确保你清楚这次是想控制\"怎么动\"还是\"参照什么\"，并说明如果需求落在产品页未说明的范围内，你会怎么处理（提示：保留为未知，不要替产品下结论）。",
  "completion_check": "学生能解释参考视频用于传达动态信息、参考素材处于参照与控制位置且作用范围不扩展到其他内容，并能说明独立音频上传路径未被现有证据单独验证（而不是不支持）。",
  "boundaries_and_misconceptions": [
    "把参考视频当成风格或外观控制手段。产品页把其用途限定在动态信息方面，未说明非动态用途。",
    "把参考图片与参考视频的作用范围读成\"决定整个结果\"。它们处于参照与控制位置，作用范围未扩展到改变其他内容。",
    "把范围描述读成禁止性规定。作用范围描述不等于禁止其他用法。",
    "把\"产品页未说明\"读成\"产品页禁止\"。未知要保留为未知。",
    "把音频引用示例读成独立音频上传入口已被验证。它只说明音频参与方式，独立上传路径仍为未单独验证。"
  ],
  "lesson_summary": "本课把参考素材的用途与边界讲清了：参考视频用于传达动态信息（运镜速度、人物轨迹、动作调度、多人互动），参考图片作为视觉参考，两者都处于参照与控制位置、作用范围不扩展到改变生成结果的其他内容。你同时练习了两种「保留为未知」的处理方式——产品页未说明的非动态用途，以及未被单独验证的独立音频上传路径。",
  "limitations": "只覆盖即梦 Seedance 2.5 产品页对参考用途与作用范围的说明；不代表底层模型完整能力，也不代表所有账号、地区或设备端已开放相同能力；不说明素材时长、格式、数量、动作迁移精度，也不说明与文字提示词的优先级；本课不含界面操作步骤。",
  "status": "full_course"
}
