{
  "lesson_id": "JCA-M04-L03",
  "module_id": "JCA-M04",
  "title": "图片提示词的对象组织与歧义修订",
  "lesson_role": "PROCEDURE",
  "scope": "Jimeng Product Layer；官方图片提示词指南的基础表达建议（对象与短句组织、歧义修订）。",
  "learner_outcomes": [
    "输入以对象为起点、组织为短句的图片提示词",
    "在出现歧义词时完成一次改写"
  ],
  "knowledge_refs": ["JIM-K-0049", "JIM-K-0050"],
  "graph_support_refs": [],
  "opening": "视频与图片两组建议有相似的思路，但侧重不同：图片指南更强调「从对象开始」和「别留下让人误会的词」。",
  "teaching_points": [
    {
      "point_id": "M04-L03-P01",
      "knowledge_refs": ["JIM-K-0049"],
      "explanation": "官方图片提示词指南建议：**先交代要创作的对象**，并把提示**组织为短句**。因此起点不是形容词，而是对象本身；句子的长度也要控制。这是与视频建议可对照的地方，但两者来自不同指南。",
      "scope_note": "2026-10-04 读取的官方建议，未给出适用模型或软件版本；不是效果结论。"
    },
    {
      "point_id": "M04-L03-P02",
      "knowledge_refs": ["JIM-K-0050"],
      "explanation": "官方指南还建议**避免歧义词，并重新措辞提示**。这是一个可执行的自查动作：找出可能被理解成多种意思的词，把它换成指向明确的说法。与所有同类建议一样，它不保证一次成功，也不包含完整 Prompt 技法。",
      "scope_note": "只说明「避免歧义 + 重新措辞」这一方向；不含词汇表、改写示例或效果承诺。"
    }
  ],
  "guided_practice": "`PEDAGOGICAL_EXAMPLE`（教学示例）：在引导下写出一条以对象为起点、由短句组成的图片提示词，然后找出其中一处可能引起歧义的词并完成一次改写。",
  "independent_practice": "不看两条建议，自己写一条图片提示词，并做两步自查：起点是不是对象、有没有留下歧义词。发现歧义时完成一次改写并说明你改了什么。",
  "completion_check": "学生能写出以对象为起点、组织为短句的图片提示词，并能找出歧义词并完成一次改写。",
  "boundaries_and_misconceptions": [
    "把形容词或风格词当成提示词的起点，而不是对象。",
    "把「短句」理解成越短越好，或把长提示当成写得好。",
    "发现歧义后只是删掉该词，而不是重新措辞。",
    "把官方建议当成效果保证或写作公式。"
  ],
  "lesson_summary": "本课给了图片提示词的两条官方基础建议：先交代对象、组织为短句；避免歧义词并重新措辞。两条都可直接用于自查。",
  "limitations": "只覆盖 2026-10-04 读取的官方图片提示词指南基础建议；未给出适用模型或版本；不是效果结论、不保证一次成功；不含教学示例原文（本课示例为教学自造并已标注）、完整 Prompt 技法、UI 操作或输入参数。",
  "status": "full_course"
}
