{
  "lesson_id": "JCA-M02-L02",
  "module_id": "JCA-M02",
  "title": "查看生成结果与导出",
  "lesson_role": "PROCEDURE",
  "scope": "该官方产品页所述第三步“增强、定制和导出”与 2026-10-04 观察到的结果页行为。",
  "learner_outcomes": ["检查生成结果", "完成下载导出"],
  "knowledge_refs": ["JIM-K-0053"],
  "graph_support_refs": ["CRR2-E-0003", "CRR2-E-0004"],
  "opening": "夹具。",
  "teaching_points": [{"point_id": "FIX-P01", "knowledge_refs": ["JIM-K-0053"], "explanation": "夹具。", "scope_note": "夹具。"}],
  "guided_practice": "夹具。", "independent_practice": "夹具。",
  "completion_check": "学生能找到结果预览、完成一次下载导出，并说出该环节在流程中位于“触发生成”之后。",
  "boundaries_and_misconceptions": ["夹具。"], "lesson_summary": "夹具。", "limitations": "夹具。",
  "status": "full_course"
}
