{
  "lesson_id": "JCA-M01-L02",
  "module_id": "JCA-M01",
  "title": "创作入口、准入条件与客户端范围",
  "lesson_role": "FOUNDATION",
  "scope": "Jimeng Web 2026-10-04 观察到的未登录创作首页与最小进入路径；客户端范围限 Web 观察与 iOS 版本历史两条来源。",
  "learner_outcomes": [
    "识别 Jimeng Web 创作首页的“创作”区域与“生成”“画布”入口",
    "解释未登录状态下“对话”“画布”显示“请先登录”，并指出“登录”入口位置",
    "区分历史 App 版本记录与当前 Web 观察属于不同客户端范围",
    "解释进入创作区域的最小路径"
  ],
  "knowledge_refs": ["JIM-K-0010", "JIM-K-0029", "JIM-K-0044", "JIM-K-0045", "JIM-K-0054", "JIM-K-0055", "JIM-K-0056"],
  "graph_support_refs": ["CRR2-E-0005"],
  "opening": "上一课建立了「谁会说什么」的分层判断。这一课把它用在具体地方：你在哪里开始创作、需要什么条件、以及不同客户端看到的东西为什么不能互相证明。",
  "teaching_points": [
    {
      "point_id": "M01-L02-P01",
      "knowledge_refs": ["JIM-K-0054"],
      "explanation": "在 2026-10-04 观察到的即梦官方 Web 未登录创作首页上，可以看到三样东西：一个名为「创作」的导航区域；主创作区里的「生成」与「画布」两个入口标签；以及显示「你好，今天想要创作什么？」的创作输入区。这就是本课程的起点画面。",
      "scope_note": "来自单次未登录状态观察，未标注客户端版本；不证明这些名称与入口在其他客户端、账号或时点保持一致。"
    },
    {
      "point_id": "M01-L02-P02",
      "knowledge_refs": ["JIM-K-0055", "JIM-K-0056"],
      "explanation": "未登录时，「对话」与「画布」区域均显示「请先登录」，页面上存在「登录」入口。最小进入路径为：打开官方 Web → 进入「创作」区域 → 若要使用当前的「对话」或「画布」区域，页面提示需要先登录 → 通过页面上的「登录」入口完成准入 → 回到创作首页 → 识别「生成」「画布」入口 → 在主创作输入区开始创作。注意这条提示的边界：它只说明这两个区域在未登录状态下不被直接开放，**不等于**用户服务协议要求的真实身份信息认证（那是另一条、另一层的规则）。",
      "scope_note": "不说明登录方式、账号类型、地区差异或权限条件；登录之后的具体按钮路径未在截图中显示，因此未记录为证据。"
    },
    {
      "point_id": "M01-L02-P03",
      "knowledge_refs": ["JIM-K-0044", "JIM-K-0045", "JIM-K-0029"],
      "explanation": "为什么必须区分客户端：本课引用的另一个来源是 App Store「即梦」的 iOS 版本历史——其中存在版本 2.3.0 条目，页面显示日期为「7月27日」（**页面未显示年份**，本材料不推断年份），该条目的更新说明记载「上线Seedance2.0 fast模型，全新多模态创作体验」。这属于 **iOS 客户端的历史版本记录**，与前面 Web 未登录首页的观察是**两种不同客户端、不同时点、不同性质的来源**，不能互相证明。第三样是协议层的真实身份认证前提：它规定完成认证后才可以使用生成、制作、发布功能，与「请先登录」是两个不同的要求，也不可互相替代。",
      "scope_note": "版本记录只复述页面文字：不推断 fast 版与普通版关系、不推断首次上线时间、不推断所有账号/地区/设备端已开放，也不把「全新多模态创作体验」转成质量结论。"
    }
  ],
  "guided_practice": "`PEDAGOGICAL_EXAMPLE`（以下任务为教学示例）：在已证实的 Jimeng Web 未登录页面上依次指出：①「创作」区域；②「生成」与「画布」入口；③两处「请先登录」提示的位置；④「登录」入口。然后在引导下口述最小进入路径，并回答一句：这条「请先登录」提示能不能用来证明「未登录时任何功能都不能用」。",
  "independent_practice": "不看路径清单，自己写出进入创作区域的最小路径；再从三个来源中挑两个（Web 观察 / iOS 版本历史 / 协议层认证要求），各写一句「它能说明什么、不能说明什么」。要求：不得推断版本年份，不得把不同客户端互相证明。",
  "completion_check": "学生能在该页面上指出创作区域、两个入口、两处未登录提示与登录入口，说出最小进入路径，并正确说明「请先登录」不等于真实身份认证要求、Web 观察与 iOS 版本记录不能互相证明。",
  "boundaries_and_misconceptions": [
    "把「请先登录」当成协议要求的真实身份信息认证。两者是不同层、不同来源的两个要求。",
    "用 iOS 版本记录证明 Web 界面行为，或反过来用 Web 观察证明 iOS 版本状态。",
    "为版本 2.3.0 推断年份。页面未显示年份，推断即为虚构。",
    "把「未登录时『对话』『画布』不开放」扩大成「未登录时无法使用其它任何功能」。",
    "把「创作/生成/画布」等名称当作永久不变的固定结构。"
  ],
  "lesson_summary": "本课把分层判断落到了起点画面上：认识 Web 未登录创作首页的创作区域、两个入口与登录准入提示，记住最小进入路径，并学会不把三种来源（Web 观察、iOS 版本历史、协议层认证要求）互相证明。",
  "limitations": "只覆盖 2026-10-04 的单次未登录 Web 观察与 App Store 版本历史条目；不含登录后页面结构、不含 iOS/Android 界面路径、不含会员/积分/价格/权限条件；不推断版本年份；本课不含任何创作操作步骤。",
  "status": "full_course"
}
