{
  "lesson_id": "JCA-M07-L03",
  "module_id": "JCA-M07",
  "title": "内容合规要求与禁止内容类型",
  "lesson_role": "SAFETY",
  "scope": "平台规则限 P14 所保存的第 4.3 节合规与来源标注要求，以及第 4.4–4.7 节的四类禁止性规则（条款级）。",
  "learner_outcomes": [
    "解释内容须符合法律法规要求，以及特定信息须准确标注来源的要求",
    "区分违法违规、不良、欺骗性与高危险性三类禁止内容规则",
    "识别扰乱平台经营秩序信息规则的对象范围"
  ],
  "knowledge_refs": ["JIM-K-0030", "JIM-K-0031", "JIM-K-0032", "JIM-K-0033", "JIM-K-0034"],
  "graph_support_refs": ["POL-E-0004", "POL-E-0005"],
  "opening": "前两课处理了输入与输出两端的义务。这一课处理内容本身的两件事：一是\"必须做到什么\"（合规与来源标注），二是\"不得出现什么\"（四类禁止性规则）。四类规则是并列的规则族，本课不会把它们排成严重程度等级。",
  "teaching_points": [
    {
      "point_id": "M07-L03-P01",
      "knowledge_refs": ["JIM-K-0030"],
      "explanation": "所选条款要求用户保证所输入、生成、发布或传播的信息内容——无论是否公开——符合法律法规要求；并且当内容涉及国内外时事、公共政策、社会事件等相关信息时，应当准确标注信息来源。这一条有两点值得注意：它覆盖的是\"全流程内容\"而不只是发布环节，并且它对特定题材**附加了一个动作要求**（标注来源），而不是只提要求。",
      "scope_note": "只说明条款提出的要求；不判断具体内容是否合规，不规定标注格式，也不解释\"特定题材\"的具体边界。"
    },
    {
      "point_id": "M07-L03-P02",
      "knowledge_refs": ["JIM-K-0031"],
      "explanation": "第 4.4 节禁止用户输入、生成、制作、复制、发布、传播该节列举的十二类违法违规内容。这里记录的是一条**条款级**知识：它说明该节以十二类列举的方式构成禁止范围，而不逐条复述那十二类分别是什么。这样记录的代价是看不到子项，好处是不把子项清单变成可能被误引的\"简表\"。",
      "scope_note": "不复述十二类子项；不判断任何具体内容的性质；不构成法律意见。"
    },
    {
      "point_id": "M07-L03-P03",
      "knowledge_refs": ["JIM-K-0032"],
      "explanation": "第 4.5 节禁止用户输入、生成、制作、复制、发布、传播该节列举的十一项不良内容，并要求用户主动抵制此类内容的传播。与上一节相比，这一节多了一项**行为要求**：不只是\"不做\"，还包括主动抵制传播。",
      "scope_note": "不复述十一项子项；不判断具体内容；该节的对象类别与第 4.4 节的\"违法违规\"不同，不要把两节合并成同一类。"
    },
    {
      "point_id": "M07-L03-P04",
      "knowledge_refs": ["JIM-K-0033"],
      "explanation": "第 4.6 节禁止用户输入、生成、制作、复制、发布、传播含有欺骗性、高危险性、危害表演者自身或他人身心健康的内容，该节并列出了四类具体情形。它的规范对象是\"欺骗性与高危险性\"，与前两节的\"违法违规\"\"不良\"是**不同的类别**，不要互相替代。",
      "scope_note": "不复述四类情形；不判断具体内容；三类规则的类别划分来自条款结构，不是严重程度排序。"
    },
    {
      "point_id": "M07-L03-P05",
      "knowledge_refs": ["JIM-K-0034"],
      "explanation": "第 4.7 节禁止用户输入、生成、制作、复制、发布、传播扰乱平台经营秩序的信息，并举例包括垃圾信息、商业招揽信息、过度营销信息、与所评论内容无关联的信息，以及刻意使用字符组合以逃避技术审核的信息。这一节的规范对象是\"平台经营秩序\"，其中的\"字符组合逃避审核\"直接指向文本输入的形式，与前几节的内容类别不同。",
      "scope_note": "只说明该节的对象范围与举例；不判断具体信息是否扰乱秩序，也不解释技术审核的实现方式。"
    }
  ],
  "guided_practice": "给定五条简短的内容描述，在引导下逐条判断它属于哪一类规则：合规/来源标注要求、违法违规类、不良内容类、欺骗性与高危险性类，或经营秩序类。要求每条都写出判断依据（例如\"该节以列举方式禁止此类内容\"）。五条描述为 `PEDAGOGICAL_EXAMPLE`，不是条款子项的复述。",
  "independent_practice": "自己写出三条\"我会避免的输入类型\"，为每条标注它对应哪一类规则，并说明\"如果我不确定某条内容属于哪一类，我应当怎么处理\"（提示：不确定不等于允许，也不等于已经违规）。",
  "completion_check": "学生能对给定内容完成类别归类，指出至少一种需要标注信息来源的情形，并说明四类规则是并列的类别而不是严重程度等级。",
  "boundaries_and_misconceptions": [
    "把四类禁止性规则排成\"由轻到重\"的等级。它们是并列的规则族，条款结构不支持程度排序。",
    "凭想象补全子项清单（十二类、十一项、四类）。本课记录的是条款级知识，子项未入库。",
    "判断具体内容的性质或给出合规结论。本课只能说明规则限定了哪些类别。",
    "把\"内容合规要求\"只理解为发布环节。该条覆盖输入、生成、发布与传播的整条链路。",
    "\"我不知道这属于哪一类\"不等于\"它没问题\"。不确定时应先按最保守的方式处理，而不是默认放行。"
  ],
  "lesson_summary": "本课把第 4.3–4.7 节的内容规则整理成两类：一类是\"必须做到\"（内容符合法律法规、特定题材准确标注来源），一类是\"不得出现\"（违法违规、不良、欺骗性与高危险性、扰乱经营秩序四类条款级规则）。你练习了类别判断，并确认了四类规则之间是并列关系而非严重程度排序。",
  "limitations": "只覆盖 P14 第 4.3–4.7 节所选命题；条款级记录不含子项清单，不得据本课复述或补全子项；不判断具体内容性质、不构成法律意见；本课不引入任何未验证的界面、阈值或审核机制细节。",
  "status": "full_course"
}
