{
  "lesson_id": "JCA-M02-L02",
  "module_id": "JCA-M02",
  "title": "查看生成结果与导出",
  "lesson_role": "PROCEDURE",
  "scope": "该官方产品页所述第三步\"增强、定制和导出\"，以及 2026-10-04 观察到的 Jimeng Web 结果页中的查看与下载行为。",
  "learner_outcomes": [
    "检查生成结果",
    "完成下载导出"
  ],
  "knowledge_refs": ["JIM-K-0053"],
  "graph_support_refs": ["CRR2-E-0003", "CRR2-E-0004"],
  "opening": "上一课你触发了生成。这一课处理产出物：查看结果、判断是否需要调整、然后导出。本课的位置不是随意安排的——它在流程上位于\"触发生成\"之后，这一点稍后会用一条流程事实说明。",
  "teaching_points": [
    {
      "point_id": "M02-L02-P01",
      "knowledge_refs": ["JIM-K-0053"],
      "explanation": "该页第三步说明：生成之后可以查看图像，并使用\"修复\"、\"展开\"和\"删除\"来调整图像，满意后点击下载按钮导出；此外还可以转到\"画布\"进行进一步的图像编辑。这一课的重点是这一串动作的**顺序与归属**：先查看，再决定是否调整，最后下载。",
      "scope_note": "只描述该页写明的动作与去向；\"免费编辑\"是该页措辞，不作为价格或权益承诺；不描述修复、展开、删除的具体参数与效果。"
    },
    {
      "point_id": "M02-L02-P02",
      "knowledge_refs": ["JIM-K-0053"],
      "explanation": "这一课为什么必须排在上一课之后：在流程结构上，\"上传素材并输入提示词\"这一步（JIM-K-0052）与\"生成、预览并保存\"这一步（JIM-K-0053）之间存在**流程先后**关系，记录为 CRR2-E-0004（PROCEDURE_PRECEDES）。因此本课内容在流程上位于触发之后。请注意这条关系的性质：它是**流程事实**，不是教学偏好，也不是\"必须先掌握某个知识点才能学习下一个知识点\"的知识前置要求。",
      "scope_note": "该先后只表示产品页所述流程内的步骤顺序；不表示教学顺序，不含界面跳转与等待细节，也不说明失败重试路径。"
    }
  ],
  "guided_practice": "对上一课触发得到的产出物，按顺序完成：查看结果预览 → 判断是否需要调整，如需调整则使用\"修复\"、\"展开\"或\"删除\"中的一种 → 满意后点击下载完成导出。完成后指出\"画布\"入口存在，并说出这一步在流程中的位置。",
  "independent_practice": "不看动作清单，自行完成一次\"查看 → 判断 → （可选）调整 → 下载\"的循环，然后回答两个问题：你为什么选择调整（或不调整）？如果没有你要用的调整功能，你还能否完成导出这一步？",
  "completion_check": "学生能找到结果预览、完成一次下载导出，并说出该环节在流程中位于\"触发生成\"之后。",
  "boundaries_and_misconceptions": [
    "把\"免费编辑\"当成权益承诺或价格说明。它是该页措辞。",
    "假定\"修复/展开/删除\"在所有版本都一定存在。本课不证明这些功能在所有版本存在。",
    "把流程先后（PROCEDURE_PRECEDES）说成知识前置（PREREQUISITE_OF）。前者是流程事实，后者是知识依赖，二者不能混用。",
    "把\"画布\"当成同一步骤内的子动作。它的完整能力不在本课范围。"
  ],
  "lesson_summary": "本课完成了流程的最后一段：查看生成结果、按需使用修复/展开/删除做一次调整、然后下载导出，并确认了\"画布\"入口存在。同时明确了一件容易混淆的事：本课之所以排在上一课之后，依据是流程先后这一事实，而不是知识前置关系。",
  "limitations": "只覆盖该官方产品页所述第三步与 2026-10-04 的结果页观察；\"免费编辑\"不作为权益承诺；不描述调整功能的具体参数与效果，不证明其在所有版本存在；\"画布\"的完整能力、界面跳转与失败重试路径均不在本课范围。",
  "status": "full_course"
}
